{
  "bundle_version": "0.1.0",
  "generated_at": "2026-04-06T20:55:45.544245+00:00",
  "generator": {
    "tool": "context-handoff-bundle",
    "mode": "generate"
  },
  "source_inputs": [
    "C:\\Users\\sandm\\clawd\\projects\\context-handoff-bundle\\examples\\sample-notes.md"
  ],
  "notes": "Generated from structured markdown notes."
}